{
  "schemaVersion": 1,
  "kind": "behavior",
  "suite": "product-ui",
  "description": "Product workflows where current state, limitations, and real recovery actions must remain exact.",
  "cases": [
    {
      "id": "sh_beh_import_failure_zh",
      "status": "accepted",
      "addedAt": "2026-08-22",
      "acceptedAt": "2026-08-22",
      "origin": "synthetic",
      "locale": "zh-CN",
      "surface": "product-workflow",
      "tags": [
        "error",
        "real-action",
        "workflow"
      ],
      "context": "文件导入详情页。解析在第 214 行失败，已导入的记录没有保存；页面只有重新上传入口。",
      "inputCopy": [
        {
          "role": "heading",
          "text": "阶段 3 验收未通过"
        },
        {
          "role": "body",
          "text": "Parser pipeline 在 row 214 抛错，请完成修复闭环。"
        },
        {
          "role": "button",
          "text": "处理问题"
        }
      ],
      "approvedCopy": [],
      "verifiedFacts": [
        "解析在第 214 行失败",
        "本次导入没有保存任何记录",
        "用户可以重新上传文件"
      ],
      "availableActions": [
        {
          "id": "upload-again",
          "label": "重新上传",
          "destination": "/imports/new"
        }
      ],
      "permissionState": "unrestricted",
      "mustPreservePropositions": [
        "指出第 214 行",
        "说明本次没有保存记录",
        "只提供重新上传这一真实恢复动作"
      ],
      "mustRemoveIntents": [
        "暴露内部阶段编号、验收和修复闭环语言",
        "把解析器实现名称作为用户解释"
      ],
      "mustNotInfer": [
        "具体字段或格式错误原因",
        "可在页面内修复文件",
        "可重试当前任务或恢复部分记录"
      ],
      "layoutConstraints": [
        "错误标题不超过两行",
        "主按钮保持一个"
      ],
      "rationale": "错误文案必须从内部流水线语言转成可验证的当前状态和唯一恢复路径。",
      "safetyImpact": "critical",
      "supersedes": []
    },
    {
      "id": "sh_beh_approved_workflow_en",
      "status": "accepted",
      "addedAt": "2026-08-22",
      "acceptedAt": "2026-08-22",
      "origin": "regression",
      "locale": "en",
      "surface": "product-workflow",
      "tags": [
        "approved-copy",
        "permission",
        "scope"
      ],
      "context": "A billing settings panel. Legal approved the renewal sentence. The current viewer can see the plan but cannot change it; no request-access control exists.",
      "inputCopy": [
        {
          "role": "heading",
          "text": "Plan settings"
        },
        {
          "role": "body",
          "text": "Your subscription renews automatically on October 1 unless canceled before renewal."
        },
        {
          "role": "status",
          "text": "Implementation note: hide mutation controls for viewer role"
        }
      ],
      "approvedCopy": [
        {
          "role": "body",
          "text": "Your subscription renews automatically on October 1 unless canceled before renewal."
        }
      ],
      "verifiedFacts": [
        "The subscription renews automatically on October 1 unless canceled before renewal",
        "The viewer role cannot change the plan",
        "There is no request-access action"
      ],
      "availableActions": [],
      "permissionState": "read-only",
      "mustPreservePropositions": [
        "Preserve the approved renewal sentence verbatim",
        "State that the viewer cannot change the plan"
      ],
      "mustRemoveIntents": [
        "Expose the implementation note or mutation-control terminology"
      ],
      "mustNotInfer": [
        "A route to cancel, manage, upgrade, or request access",
        "A different renewal date or cancellation condition",
        "The reason the viewer has read-only access"
      ],
      "layoutConstraints": [
        "Do not add a button or link",
        "Keep the approved sentence as one unchanged copy fragment"
      ],
      "rationale": "Natural wording cannot override approved legal copy or create a missing permission workflow.",
      "safetyImpact": "critical",
      "supersedes": []
    },
    {
      "id": "sh_beh_reverse_emphasis_zh",
      "status": "candidate",
      "addedAt": "2026-08-27",
      "origin": "real-redacted",
      "locale": "zh-CN",
      "surface": "product-workflow",
      "tags": [
        "reverse-emphasis",
        "internal-language"
      ],
      "context": "分析报告导出说明。已确认导出物是固定、版本化的字段集合；页面只有下载该字段集合的入口。规划讨论否决了把全部回答交给一个模型生成整份报告，但稿子仍把否决项写进了界面。",
      "inputCopy": [
        {
          "role": "heading",
          "text": "这条链路中不存在把全部回答交给一个模型、让它生成整份报告的步骤"
        },
        {
          "role": "body",
          "text": "导出器不返回无界报告 JSON。"
        },
        {
          "role": "button",
          "text": "继续评估"
        }
      ],
      "approvedCopy": [],
      "verifiedFacts": [
        "导出结果是固定、版本化的字段集合",
        "用户可以下载该字段集合"
      ],
      "availableActions": [
        {
          "id": "download-fields",
          "label": "下载字段集合",
          "destination": "/reports/current/fields"
        }
      ],
      "permissionState": "unrestricted",
      "mustPreservePropositions": [
        "说明导出物是固定、版本化的字段集合",
        "只提供下载该字段集合这一真实动作"
      ],
      "mustRemoveIntents": [
        "把已否决的整份报告生成方案写给用户",
        "用“不返回无界报告 JSON”代替实际导出物"
      ],
      "mustNotInfer": [
        "可以下载整份自由文本报告",
        "字段集合无版本或可任意扩展",
        "会把全部回答交给一个模型重写报告"
      ],
      "layoutConstraints": [
        "标题不超过两行",
        "主按钮保持一个"
      ],
      "rationale": "反向强调要把已否决路径从界面删除，并把否定契约改写成用户实际拿到的输出物；不能把真实限制一并抹掉。",
      "safetyImpact": "high",
      "supersedes": []
    },
    {
      "id": "sh_beh_reverse_emphasis_en",
      "status": "candidate",
      "addedAt": "2026-08-27",
      "origin": "real-redacted",
      "locale": "en",
      "surface": "product-workflow",
      "tags": [
        "reverse-emphasis",
        "internal-language"
      ],
      "context": "Export help on an analysis report. The confirmed artifact is a fixed, versioned field set, and the page only offers that download. Planning rejected handing every answer to one model to write the whole report, but the draft still explains the rejection to the user.",
      "inputCopy": [
        {
          "role": "heading",
          "text": "This flow has no step that hands every answer to one model to generate the entire report"
        },
        {
          "role": "body",
          "text": "The exporter does not return unbounded report JSON."
        },
        {
          "role": "button",
          "text": "Continue evaluation"
        }
      ],
      "approvedCopy": [],
      "verifiedFacts": [
        "The export is a fixed, versioned field set",
        "The user can download that field set"
      ],
      "availableActions": [
        {
          "id": "download-fields",
          "label": "Download field set",
          "destination": "/reports/current/fields"
        }
      ],
      "permissionState": "unrestricted",
      "mustPreservePropositions": [
        "State that the export is a fixed, versioned field set",
        "Offer only the download of that field set"
      ],
      "mustRemoveIntents": [
        "Tell the user about the rejected whole-report generation path",
        "Use “does not return unbounded report JSON” in place of the actual artifact"
      ],
      "mustNotInfer": [
        "A download of an unbounded free-text report",
        "An unversioned or arbitrarily expandable field set",
        "That every answer will be sent to one model to rewrite the report"
      ],
      "layoutConstraints": [
        "The heading fits in two lines",
        "Keep a single primary button"
      ],
      "rationale": "Reverse emphasis should drop rejected-path residue and restate the real output; it must not delete genuine limitations.",
      "safetyImpact": "high",
      "supersedes": []
    }
  ]
}
